{
  "version": 1,
  "devices": [
    {
      "name": "rt-tokyo-01",
      "role": "router",
      "site": "Tokyo-HQ",
      "interfaces": [
        {
          "name": "Gi0/0/0",
          "ip_address": "10.255.0.1/30",
          "description": "WAN #1"
        },
        {
          "name": "Gi0/0/1",
          "description": "to sw"
        }
      ],
      "position": {
        "x": 60,
        "y": 60
      }
    },
    {
      "name": "rt-tokyo-02",
      "role": "router",
      "site": "Tokyo-HQ",
      "interfaces": [
        {
          "name": "Gi0/0/0",
          "ip_address": "10.255.0.5/30",
          "description": "WAN #2"
        }
      ],
      "position": {
        "x": 300,
        "y": 60
      }
    },
    {
      "name": "sw-tokyo-01",
      "role": "switch",
      "site": "Tokyo-HQ",
      "position": {
        "x": 180,
        "y": 210
      }
    },
    {
      "name": "rt-osaka-01",
      "role": "router",
      "site": "Osaka-DC",
      "interfaces": [
        {
          "name": "Gi0/0/0",
          "ip_address": "10.255.0.2/30",
          "description": "WAN #1"
        }
      ],
      "position": {
        "x": 780,
        "y": 60
      }
    },
    {
      "name": "rt-osaka-02",
      "role": "router",
      "site": "Osaka-DC",
      "interfaces": [
        {
          "name": "Gi0/0/0",
          "ip_address": "10.255.0.6/30",
          "description": "WAN #2"
        }
      ],
      "position": {
        "x": 1020,
        "y": 60
      }
    },
    {
      "name": "sw-osaka-01",
      "role": "switch",
      "site": "Osaka-DC",
      "position": {
        "x": 900,
        "y": 210
      }
    }
  ],
  "cables": [
    {
      "a": {
        "device": "rt-tokyo-01",
        "interface": "Gi0/0/1"
      },
      "b": {
        "device": "sw-tokyo-01",
        "interface": "Gi1/0/49"
      },
      "type": "cat6",
      "status": "connected"
    },
    {
      "a": {
        "device": "rt-tokyo-02"
      },
      "b": {
        "device": "sw-tokyo-01"
      },
      "type": "cat6",
      "status": "connected"
    },
    {
      "a": {
        "device": "rt-osaka-01"
      },
      "b": {
        "device": "sw-osaka-01"
      },
      "type": "cat6",
      "status": "connected"
    },
    {
      "a": {
        "device": "rt-osaka-02"
      },
      "b": {
        "device": "sw-osaka-01"
      },
      "type": "cat6",
      "status": "connected"
    }
  ],
  "circuits": [
    {
      "a": {
        "site": "Tokyo-HQ",
        "device": "rt-tokyo-01",
        "interface": "Gi0/0/0"
      },
      "b": {
        "site": "Osaka-DC",
        "device": "rt-osaka-01",
        "interface": "Gi0/0/0"
      },
      "cid": "CID-0001",
      "provider": "Carrier-A",
      "type": "leased line",
      "commit_rate": "1Gbps",
      "status": "active"
    },
    {
      "a": {
        "site": "Tokyo-HQ",
        "device": "rt-tokyo-02",
        "interface": "Gi0/0/0"
      },
      "b": {
        "site": "Osaka-DC",
        "device": "rt-osaka-02",
        "interface": "Gi0/0/0"
      },
      "cid": "CID-0002",
      "provider": "Carrier-B",
      "type": "IP-VPN",
      "commit_rate": "1Gbps",
      "status": "active"
    }
  ]
}
