{
  "version": 1,
  "devices": [
    {
      "name": "rt-hq-01",
      "device_type": "Cisco C8300",
      "role": "router",
      "site": "HQ",
      "tenant": "NetOps",
      "vrfs": [
        "PROD"
      ],
      "interfaces": [
        {
          "name": "Po1",
          "type": "lag",
          "description": "LAG to sw-hq-01"
        },
        {
          "name": "Gi0/0/1",
          "lag": "Po1"
        },
        {
          "name": "Gi0/0/2",
          "lag": "Po1"
        },
        {
          "name": "Gi0/0/0",
          "description": "WAN uplink to the interconnect"
        },
        {
          "name": "Gi0/0/0.100",
          "ip_address": "169.254.10.1/30",
          "type": "virtual",
          "description": "interconnect VIF",
          "vrf": "PROD"
        }
      ],
      "config_context": {
        "bgp": {
          "asn": 65010,
          "neighbors": [
            {
              "peer": "169.254.10.2",
              "remote_asn": 64512
            }
          ]
        }
      },
      "position": {
        "x": 120,
        "y": 60
      }
    },
    {
      "name": "sw-hq-01",
      "role": "switch",
      "site": "HQ",
      "position": {
        "x": 120,
        "y": 210
      }
    },
    {
      "name": "aws-tgw",
      "role": "external_peer",
      "site": "AWS",
      "position": {
        "x": 820,
        "y": 60
      }
    }
  ],
  "provider_networks": [
    {
      "name": "AWS Direct Connect",
      "provider": "AWS",
      "position": {
        "x": 470,
        "y": 60
      }
    }
  ],
  "cables": [
    {
      "a": {
        "device": "rt-hq-01",
        "interface": "Po1"
      },
      "b": {
        "device": "sw-hq-01"
      },
      "bandwidth": "2x1G LAG",
      "status": "connected"
    }
  ],
  "circuits": [
    {
      "a": {
        "site": "HQ",
        "device": "rt-hq-01",
        "interface": "Gi0/0/0"
      },
      "b": {
        "provider_network": "AWS Direct Connect"
      },
      "cid": "DX-CID-01",
      "provider": "Equinix",
      "type": "Direct Connect",
      "commit_rate": "1Gbps",
      "status": "active"
    }
  ],
  "logical_links": [
    {
      "a": {
        "device": "rt-hq-01",
        "vrf": "PROD",
        "interface": "Gi0/0/0.100"
      },
      "b": {
        "device": "aws-tgw",
        "id": "tgw-attach-01"
      },
      "link_id": "dxvif-abc123",
      "vlan": "100",
      "label": "eBGP over DX VIF"
    }
  ]
}
